{"schema_id":"https://weflow.local/contracts/v1/evaluation-oracle.schema.json","schema_version":"v1","tenant_id":"tenant-alpha","oracle_id":"oracle-policy-delivery-recovery","evaluation_task_id":"policy-delivery-recovery","expected_outcome":"recovered_after_interruption","expected_local_effect_count":1,"requires_approval":true,"required_hard_gates":["tenant_reference","offline_replay","external_write_absent","local_effect_identity","approval_binding","evidence_lineage","expected_outcome"],"quality_weights":{"outcome":40,"evidence":25,"recovery":25,"efficiency":10}}
