{"schema_id":"https://weflow.local/contracts/v1/evaluation-oracle.schema.json","schema_version":"v1","tenant_id":"tenant-alpha","oracle_id":"oracle-workflow-ticket-handoff","evaluation_task_id":"workflow-ticket-handoff","expected_outcome":"ticket_ready","expected_local_effect_count":2,"required_hard_gates":["tenant_reference","offline_replay","external_write_absent","local_effect_identity","evidence_lineage","expected_outcome"],"quality_weights":{"outcome":40,"evidence":25,"recovery":25,"efficiency":10}}
